{
  "id": "bundled-min",
  "name": "Bundled Minimum Fixture",
  "version": "1.0.0",
  "published_at": "2026-09-16T00:00:00Z",
  "source_class": "bundled",
  "embedding": {
    "model_id": "bge-small-en-v1.5",
    "dims": 384,
    "normalize": true
  },
  "chunking": {
    "strategy": "fixed-words",
    "size": 256,
    "overlap": 100
  },
  "docs": [
    {
      "path": "docs/welcome.json",
      "sha256": "6420f0588ade5092a39782dc5c8785cbf735f159d138bd659a80b3f2fa208e14",
      "title": "Welcome",
      "mime": "application/json"
    },
    {
      "path": "docs/faq.json",
      "sha256": "f739f41b4627d1aa801531c6c9c9eae9bd9a09dcb7906694f0172e904fea7ee0",
      "title": "FAQ",
      "mime": "application/json"
    }
  ]
}
